{
  "name": "Import from URL",
  "description": "Paste a link to a recipe page and get a structured recipe",
  "status": "blocked",
  "priority": "medium",
  "blocked_by": "offline-mode",
  "notes": "Imported recipes have to be saved for offline use, which needs the sync queue first.",
  "created": "2026-07-20T10:00:00Z",
  "updated": "2026-07-20T10:00:00Z",
  "edited": "2026-09-08T09:41:00Z"
}
